{
 "meta": {
  "report_date": "2026-09-23",
  "weekday_es": "miércoles",
  "timezone": "Europe/Madrid",
  "rules_version": 1,
  "prompt_version": "daily-v1.0",
  "market_context": {
   "us_session_yesterday": true,
   "weekend": false,
   "us_holiday_today": false,
   "blocks_available": [
    "bitcoin",
    "sentimiento",
    "liquidez",
    "demanda_etf",
    "onchain",
    "macro",
    "derivados"
   ]
  },
  "limits": {
   "lectura_max_sentences": 4,
   "lectura_max_chars": 480,
   "vigilar_max_chars": 200,
   "block_comment_max_chars": 140
  }
 },
 "facts": [
  {
   "id": "btc_usd",
   "label_es": "Bitcoin (USD)",
   "value": 101250.0,
   "display": "$101.250",
   "display_abs": "$101.250",
   "unit": "USD",
   "as_of": "2026-09-23T06:30:12Z",
   "as_of_label": null,
   "source": {
    "name": "CoinGecko",
    "url": "https://www.coingecko.com/en/api"
   },
   "is_provisional": false,
   "freshness": "fresh",
   "state": {
    "axis": "precio",
    "code": "move_calm",
    "label_es": "movimiento contenido",
    "color": "none"
   },
   "salience": 1.0,
   "selected": true,
   "interpretation_hints": [],
   "caveats": []
  },
  {
   "id": "btc_eur",
   "label_es": "Bitcoin (EUR)",
   "value": 86540.0,
   "display": "86.540 €",
   "display_abs": "86.540 €",
   "unit": "EUR",
   "as_of": "2026-09-23T06:30:12Z",
   "as_of_label": null,
   "source": {
    "name": "CoinGecko",
    "url": "https://www.coingecko.com/en/api"
   },
   "is_provisional": false,
   "freshness": "fresh",
   "state": {
    "axis": "precio",
    "code": "move_calm",
    "label_es": "movimiento contenido",
    "color": "none"
   },
   "salience": 0.9,
   "selected": true,
   "interpretation_hints": [],
   "caveats": []
  },
  {
   "id": "btc_chg_24h_pct",
   "label_es": "Variación 24 h",
   "value": 0.3,
   "display": "+0,3 %",
   "display_abs": "0,3 %",
   "unit": "pct",
   "as_of": "2026-09-23T06:30:12Z",
   "as_of_label": null,
   "source": {
    "name": "CoinGecko",
    "url": "https://www.coingecko.com/en/api"
   },
   "is_provisional": false,
   "freshness": "fresh",
   "state": {
    "axis": "precio",
    "code": "move_calm",
    "label_es": "movimiento contenido",
    "color": "none"
   },
   "salience": 0.8,
   "selected": true,
   "interpretation_hints": [],
   "caveats": []
  },
  {
   "id": "btc_chg_7d_pct",
   "label_es": "Variación 7 días",
   "value": -2.4,
   "display": "−2,4 %",
   "display_abs": "2,4 %",
   "unit": "pct",
   "as_of": "2026-09-23T06:30:12Z",
   "as_of_label": null,
   "source": {
    "name": "CoinGecko",
    "url": "https://www.coingecko.com/en/api"
   },
   "is_provisional": false,
   "freshness": "fresh",
   "state": {
    "axis": "precio",
    "code": "move_calm",
    "label_es": "movimiento contenido",
    "color": "none"
   },
   "salience": 1.0,
   "selected": true,
   "interpretation_hints": [
    {
     "id": "btc_chg_7d_pct:h.eur_vs_usd",
     "text": "en euros, la semana es {{f:btc_chg_7d_eur_pct}}"
    }
   ],
   "caveats": []
  },
  {
   "id": "btc_chg_7d_eur_pct",
   "label_es": "Variación 7 días (en euros)",
   "value": -0.6,
   "display": "−0,6 %",
   "display_abs": "0,6 %",
   "unit": "pct",
   "as_of": "2026-09-23T06:30:12Z",
   "as_of_label": null,
   "source": {
    "name": "CoinGecko",
    "url": "https://www.coingecko.com/en/api"
   },
   "is_provisional": false,
   "freshness": "fresh",
   "state": {
    "axis": "precio",
    "code": "n/a",
    "label_es": "",
    "color": "none"
   },
   "salience": 0.4,
   "selected": true,
   "interpretation_hints": [],
   "caveats": []
  },
  {
   "id": "btc_ath_usd",
   "label_es": "Máximo histórico (USD, intradía agregado)",
   "value": 126080.0,
   "display": "$126.080",
   "display_abs": "$126.080",
   "unit": "USD",
   "as_of": "2026-09-23T06:30:12Z",
   "as_of_label": null,
   "source": {
    "name": "CoinGecko",
    "url": "https://www.coingecko.com/en/api"
   },
   "is_provisional": false,
   "freshness": "fresh",
   "state": {
    "axis": "precio",
    "code": "n/a",
    "label_es": "",
    "color": "none"
   },
   "salience": 0.5,
   "selected": true,
   "interpretation_hints": [],
   "caveats": []
  },
  {
   "id": "btc_ath_usd_date",
   "label_es": "Fecha del máximo histórico (USD)",
   "value": "2025-10-06",
   "display": "6 oct 2025",
   "display_abs": null,
   "unit": "date",
   "as_of": "2026-09-23T06:30:12Z",
   "as_of_label": null,
   "source": {
    "name": "CoinGecko",
    "url": "https://www.coingecko.com/en/api"
   },
   "is_provisional": false,
   "freshness": "fresh",
   "state": {
    "axis": "precio",
    "code": "n/a",
    "label_es": "",
    "color": "none"
   },
   "salience": 0.5,
   "selected": true,
   "interpretation_hints": [],
   "caveats": []
  },
  {
   "id": "btc_drawdown_from_ath_pct",
   "label_es": "Distancia al máximo histórico",
   "value": -19.7,
   "display": "−19,7 %",
   "display_abs": "19,7 %",
   "unit": "pct",
   "as_of": "2026-09-23T06:30:12Z",
   "as_of_label": null,
   "source": {
    "name": "cálculo propio sobre CoinGecko",
    "url": "https://www.coingecko.com/en/api"
   },
   "is_provisional": false,
   "freshness": "fresh",
   "state": {
    "axis": "precio",
    "code": "correction",
    "label_es": "en corrección",
    "color": "none"
   },
   "salience": 1.0,
   "selected": true,
   "interpretation_hints": [
    {
     "id": "btc_drawdown_from_ath_pct:h.ath_days",
     "text": "{{f:btc_days_since_ath}} días desde el máximo"
    }
   ],
   "caveats": []
  },
  {
   "id": "btc_days_since_ath",
   "label_es": "Días desde el máximo histórico",
   "value": 352,
   "display": "352",
   "display_abs": "352",
   "unit": "days",
   "as_of": "2026-09-23",
   "as_of_label": null,
   "source": {
    "name": "cálculo propio",
    "url": "https://www.coingecko.com/en/api"
   },
   "is_provisional": false,
   "freshness": "fresh",
   "state": {
    "axis": "precio",
    "code": "n/a",
    "label_es": "",
    "color": "none"
   },
   "salience": 1.0,
   "selected": true,
   "interpretation_hints": [],
   "caveats": []
  },
  {
   "id": "fng_value",
   "label_es": "Índice Miedo y Codicia",
   "value": 58,
   "display": "58",
   "display_abs": "58",
   "unit": "index",
   "as_of": "2026-09-23T00:00:00Z",
   "as_of_label": null,
   "source": {
    "name": "alternative.me",
    "url": "https://alternative.me/crypto/fear-and-greed-index/"
   },
   "is_provisional": false,
   "freshness": "fresh",
   "changes": {
    "d1": {
     "id": "fng_value_1d_ago",
     "display": "61"
    },
    "d7": {
     "id": "fng_value_7d_ago",
     "display": "71"
    }
   },
   "state": {
    "axis": "sentimiento",
    "code": "Greed->Neutral",
    "label_es": "neutral (enfriamiento notable)",
    "color": "green"
   },
   "salience": 0.52,
   "selected": true,
   "interpretation_hints": [
    {
     "id": "fng_value:h.fng_path",
     "text": "de {{f:fng_value_7d_ago}} a {{f:fng_value}} en siete días"
    },
    {
     "id": "fng_value:h.fng_regime_change",
     "text": "sale de la zona de codicia"
    }
   ],
   "caveats": []
  },
  {
   "id": "fng_class",
   "label_es": "Clasificación Miedo y Codicia",
   "value": "Neutral",
   "display": "neutral",
   "display_abs": null,
   "unit": "index",
   "as_of": "2026-09-23T00:00:00Z",
   "as_of_label": null,
   "source": {
    "name": "alternative.me",
    "url": "https://alternative.me/crypto/fear-and-greed-index/"
   },
   "is_provisional": false,
   "freshness": "fresh",
   "state": {
    "axis": "sentimiento",
    "code": "n/a",
    "label_es": "",
    "color": "none"
   },
   "salience": 0.5,
   "selected": true,
   "interpretation_hints": [],
   "caveats": []
  },
  {
   "id": "fng_value_1d_ago",
   "label_es": "Miedo y Codicia (ayer)",
   "value": 61,
   "display": "61",
   "display_abs": "61",
   "unit": "index",
   "as_of": "2026-09-22T00:00:00Z",
   "as_of_label": null,
   "source": {
    "name": "alternative.me",
    "url": "https://alternative.me/crypto/fear-and-greed-index/"
   },
   "is_provisional": false,
   "freshness": "fresh",
   "state": {
    "axis": "sentimiento",
    "code": "n/a",
    "label_es": "",
    "color": "none"
   },
   "salience": 0.4,
   "selected": true,
   "interpretation_hints": [],
   "caveats": []
  },
  {
   "id": "fng_value_7d_ago",
   "label_es": "Miedo y Codicia (hace 7 días)",
   "value": 71,
   "display": "71",
   "display_abs": "71",
   "unit": "index",
   "as_of": "2026-09-16T00:00:00Z",
   "as_of_label": null,
   "source": {
    "name": "alternative.me",
    "url": "https://alternative.me/crypto/fear-and-greed-index/"
   },
   "is_provisional": false,
   "freshness": "fresh",
   "state": {
    "axis": "sentimiento",
    "code": "n/a",
    "label_es": "",
    "color": "none"
   },
   "salience": 0.5,
   "selected": true,
   "interpretation_hints": [],
   "caveats": []
  },
  {
   "id": "liquidity_regime",
   "label_es": "Liquidez global",
   "value": "expansion",
   "display": "expansión",
   "display_abs": null,
   "unit": "index",
   "as_of": "2026-08-31",
   "as_of_label": "M2 global a agosto",
   "source": {
    "name": "cálculo propio (Reserva Federal, BCE, BoE, PBoC, BoJ)",
    "url": "https://example.invalid/metodologia"
   },
   "is_provisional": true,
   "freshness": "stale_shown",
   "state": {
    "axis": "liquidez",
    "code": "expansion",
    "label_es": "favorable para la liquidez",
    "color": "green"
   },
   "salience": 0.3,
   "selected": true,
   "interpretation_hints": [],
   "caveats": [
    "La relación histórica entre liquidez y activos de riesgo no es estable."
   ]
  },
  {
   "id": "us_net_liquidity_chg_4w_pct",
   "label_es": "Liquidez neta EE. UU. — variación 4 semanas",
   "value": 1.5,
   "display": "+1,5 %",
   "display_abs": "1,5 %",
   "unit": "pct",
   "as_of": "2026-09-22T00:00:00Z",
   "as_of_label": null,
   "source": {
    "name": "cálculo propio (Reserva Federal, Tesoro de EE. UU., Fed de Nueva York)",
    "url": "https://example.invalid/metodologia"
   },
   "is_provisional": false,